[
  {
    "id": "fin_v0_001",
    "domain": "finance",
    "version": "0.1",
    "track": "investment_banking",
    "created_at": "2025-12-20",
    "source": { "type": "synthetic", "notes": "格式演示样本（虚构人物与链接）" },
    "input": {
      "find_recommendations_request": {
        "purpose": "Coffee Chat",
        "field": "Finance",
        "sender_profile": {
          "raw_text": "Person A 是一名大三学生，正在准备投行暑期实习。",
          "education": ["B.S. in Economics (in progress)"],
          "experiences": ["Campus investment club analyst (TMT pitch)"],
          "skills": ["Accounting basics", "Excel", "DCF", "PowerPoint"],
          "projects": ["Built a comps table for 10 software companies"]
        },
        "preferences": {
          "track": "Investment Banking",
          "search_intent": "寻找纽约的 TMT 投行 Analyst/Associate，愿意做 15 分钟 coffee chat，最好做过软件/互联网并购。",
          "must_have": "TMT, investment banking, analyst OR associate, New York",
          "must_not": "crypto, day trading",
          "location": "NYC, English",
          "contactability": "reply",
          "contact_channels": ["linkedin", "email"],
          "target_role_titles": ["Analyst", "Associate"],
          "seniority": "Analyst or Associate",
          "org_type": "Investment Bank",
          "bank_tier": "Unknown",
          "group": "TMT",
          "group_type": "coverage",
          "recruiting_context": {
            "role_type": "SA",
            "timeline": "Next 2-4 weeks",
            "notes": "Informational coffee chat; student recruiting context"
          }
        }
      },
      "benchmark_context": {
        "candidate_pool": [
          {
            "candidate_id": "fin_v0_001_c1",
            "name": "Jordan Lee",
            "position": "Analyst, TMT Investment Banking, Example Bank (NYC)",
            "field": "Investment Banking",
            "sources": ["https://example.com/example-bank/tmt-team"],
            "evidence_snippets": [
              {
                "id": "fin_v0_001_e_c1_1",
                "text": "Example Bank TMT team page lists Jordan Lee as an Analyst in New York.",
                "url": "https://example.com/example-bank/tmt-team"
              }
            ]
          },
          {
            "candidate_id": "fin_v0_001_c2",
            "name": "Priya Patel",
            "position": "Associate, M&A, Example Capital (NYC)",
            "field": "Investment Banking",
            "sources": ["https://example.com/example-capital/ma-team"],
            "evidence_snippets": [
              {
                "id": "fin_v0_001_e_c2_1",
                "text": "Example Capital M&A team lists Priya Patel as Associate (NYC).",
                "url": "https://example.com/example-capital/ma-team"
              }
            ]
          },
          {
            "candidate_id": "fin_v0_001_c3",
            "name": "Sam Nguyen",
            "position": "Equity Research Analyst (Technology), Example Securities",
            "field": "Sell-side Research",
            "sources": ["https://example.com/example-securities/research/technology"],
            "evidence_snippets": [
              {
                "id": "fin_v0_001_e_c3_1",
                "text": "Technology research page lists Sam Nguyen as an analyst covering software.",
                "url": "https://example.com/example-securities/research/technology"
              }
            ]
          },
          {
            "candidate_id": "fin_v0_001_c4",
            "name": "Taylor Kim",
            "position": "Quant Researcher, Example Hedge Fund",
            "field": "Hedge Fund",
            "sources": ["https://example.com/example-hf/team"],
            "evidence_snippets": [
              {
                "id": "fin_v0_001_e_c4_1",
                "text": "Team page lists Taylor Kim as a Quant Researcher.",
                "url": "https://example.com/example-hf/team"
              }
            ]
          },
          {
            "candidate_id": "fin_v0_001_c5",
            "name": "Morgan Davis",
            "position": "Product Manager, ExamplePay",
            "field": "Fintech",
            "sources": ["https://example.com/examplepay/team"],
            "evidence_snippets": [
              {
                "id": "fin_v0_001_e_c5_1",
                "text": "ExamplePay team page lists Morgan Davis as Product Manager.",
                "url": "https://example.com/examplepay/team"
              }
            ]
          }
        ],
        "notes": "闭卷评测时：只允许从 candidate_pool 里挑选并排序；每个候选必须引用其 evidence_snippets。"
      },
      "generate_email_request": {
        "sender": {
          "name": "Person A",
          "raw_text": "Junior student interested in TMT investment banking; did a campus software comps project.",
          "education": ["B.S. in Economics (in progress)"],
          "experiences": ["Campus investment club analyst (TMT pitch)"],
          "skills": ["Excel", "DCF", "Comps"],
          "projects": ["Software comps + short memo"],
          "motivation": "Learn how to break into TMT IB and what daily work looks like.",
          "ask": "15-minute coffee chat / call next week"
        },
        "receiver": {
          "name": "Jordan Lee",
          "raw_text": "Jordan Lee is an Analyst on Example Bank's TMT Investment Banking team in New York. Recent work noted: software M&A (publicly described at a high level).",
          "education": ["B.A. in Finance"],
          "experiences": ["Analyst, TMT IB, Example Bank (NYC)"],
          "skills": ["M&A", "Financial modeling"],
          "projects": [],
          "context": "Reach out for a short informational chat.",
          "sources": ["https://example.com/example-bank/tmt-team"],
          "evidence_snippets": [
            {
              "id": "fin_v0_001_e_r1",
              "text": "Example Bank TMT team page lists Jordan Lee as an Analyst in New York.",
              "url": "https://example.com/example-bank/tmt-team"
            }
          ]
        },
        "goal": "Write a first-contact cold email in English, <=170 words. Structure: Subject -> why you (cite TMT + NYC) -> value -> one clear ask (15 min next week) -> opt-out. Do not claim we met before or that you worked on specific deals together.",
        "template": null,
        "email_spec": {
          "output_language": "en",
          "tone": "professional, concise",
          "max_words": 170,
          "one_ask": {
            "type": "call",
            "duration_minutes": 15,
            "timeframe": "next week",
            "async_option": "If easier, I can send 2–3 questions by email."
          },
          "value_offer": "Share a short comps/memo framework from a campus TMT pitch.",
          "hard_rules": [
            "Do not claim a prior relationship",
            "Do not mention non-public deals",
            "Use only provided facts/evidence"
          ],
          "compliance_guardrails": {
            "forbid_investment_advice": true,
            "forbid_return_promises": true,
            "forbid_insider_info": true,
            "forbid_mentioning_unpublished_deals": true
          },
          "must_cite_evidence": true
        }
      }
    },
    "expected": {
      "find_recommendations": {
        "k": 3,
        "must_include_candidate_ids": ["fin_v0_001_c1", "fin_v0_001_c3"],
        "must_exclude_candidate_ids": ["fin_v0_001_c5"],
        "reference_ranking_candidate_ids": ["fin_v0_001_c1", "fin_v0_001_c3", "fin_v0_001_c2"],
        "notes": "c1 最匹配；c3 可作为研究/替代路径；c2 次优但仍相关。"
      },
      "generate_email": {
        "reference": {
          "subject": "Quick 15-min chat about TMT IB?",
          "body_lines": [
            "Hi Jordan,",
            "",
            "I’m a junior studying economics and I’m exploring TMT investment banking. I saw you’re an Analyst on Example Bank’s TMT team in New York, and I’d love to learn how you approached recruiting and what the day-to-day looks like on the team.",
            "",
            "This semester I built a comps table and a short memo on a set of software companies through our campus investment club, and I’m trying to pressure-test whether TMT IB is the right path for me.",
            "",
            "Would you be open to a 15-minute call next week? If easier, I’m happy to send 2–3 specific questions over email.",
            "",
            "No worries at all if your schedule is packed — thanks for considering.",
            "",
            "Best,",
            "Person A"
          ]
        },
        "assertions": {
          "language": "en",
          "max_words": 170,
          "must_include_phrases": ["15-minute", "next week", "TMT"],
          "forbidden_phrases": ["we spoke", "as we discussed", "guaranteed returns"],
          "required_elements": ["subject_line", "why_them", "value", "clear_ask", "opt_out"],
          "compliance": {
            "forbid_investment_advice": true,
            "forbid_return_promises": true,
            "forbid_insider_info": true
          }
        }
      }
    }
  },
  {
    "id": "fin_v0_002",
    "domain": "finance",
    "version": "0.1",
    "track": "private_equity",
    "created_at": "2025-12-20",
    "source": { "type": "synthetic" },
    "input": {
      "find_recommendations_request": {
        "purpose": "Job Seeking",
        "field": "Finance",
        "sender_profile": {
          "raw_text": "Person A：2 年审计 + 1 年投行并购组，目标转向中端 PE（Healthcare）。",
          "education": ["M.S. in Accounting"],
          "experiences": ["Big 4 audit (2y)", "IB M&A analyst (1y)"],
          "skills": ["LBO", "Financial modeling", "Due diligence"],
          "projects": ["Healthcare services LBO case study"]
        },
        "preferences": {
          "track": "Private Equity",
          "search_intent": "寻找 US 中端 PE 的 Associate（偏 Healthcare/HC services），愿意分享转 PE 的准备与面试建议。",
          "must_have": "private equity, associate, healthcare",
          "must_not": "real estate",